{
  "schema": "human-control-plane.snapshot.v1",
  "snapshot_identity": "sha256-canonical-payload:27daecc93b03fafa585ee95b6d67e6653d395cc455166a4b0520d6cd92ae4ac3",
  "snapshot_id": "HCP-SNAP-20260905T125829Z",
  "generated_at": "2026-09-05T12:58:29Z",
  "source_state_identity": "sha256-canonical-payload:8807e70d5d8af7f1af67d03a40d08cb2cd32d83eb1368ba260bd3076e8154415",
  "source_of_truth": "ChatGPT Library /CONTROL_PLANE_STATE.json",
  "system_state": {
    "control_status": "ESTABLISHED",
    "ucp_version": "1.0",
    "uao_version": "1.4",
    "uao_identity": "sha256:786d9feec326d816259d11b66af7acbc1f3de67636a99bffb1a1392303ab24c5",
    "authority_delta": "NONE",
    "direct_web_execution": false,
    "git_is_authority": false,
    "publication": {
      "repository": "stefm78/human-control-plane",
      "branch": "main",
      "pages_enabled_by_human": true,
      "pages_url": "https://stefm78.github.io/human-control-plane/",
      "status": "PUBLISHED_REPOSITORY",
      "render_status": "UNVERIFIED_EXTERNALLY",
      "authority": "PROJECTION_ONLY"
    }
  },
  "kernels": [
    {"name":"UCP","spec_id":"UCP-CONTROL-PLANE","version":"1.0","status":"ACTIVE","canonical_file":"UCP_ACTIVE.md","state_identity":"sha256:db37558b20e683ca13f5c5cf77a91b211f263c8c2565b91832a5ceb0040d3513","role":"ROOT","entrypoint":"INTERNAL_BOOTSTRAP","authority_class":"A6","rollback_available":false,"freshness":"VERIFIED","provenance":{"library_file_id":"file_000000007a3082439ef731d3a00f0074"}},
    {"name":"UAO","spec_id":"UAO-KERNEL","version":"1.4","status":"ACTIVE","canonical_file":"UAO_ACTIVE.md","state_identity":"sha256:786d9feec326d816259d11b66af7acbc1f3de67636a99bffb1a1392303ab24c5","role":"ORCHESTRATE","entrypoint":"INTERNAL_BOOTSTRAP","authority_class":"A0-A3","rollback_available":true,"freshness":"VERIFIED","provenance":{"library_file_id":"file_00000000a0148210ab4f7da86451a185"}},
    {"name":"UAR","spec_id":"UAR-KERNEL","version":"1.0","status":"ACTIVE","canonical_file":"UAR_ACTIVE.md","state_identity":"sha256:f0ad46c5a851ae99f61ab759e315a7cdb282de44d233fa1fd648e1da78382c94","role":"KNOW","entrypoint":"/research","authority_class":"A0","rollback_available":false,"freshness":"VERIFIED","provenance":{"library_file_id":"file_00000000f37c821093486fe6271107c9"}},
    {"name":"UAS","spec_id":"UAS-KERNEL","version":"2.2","status":"ACTIVE","canonical_file":"UAS_ACTIVE.md","state_identity":"sha256:c440a806c4c7a7825e84929e6d58f07923edddfcd1e4e641fa19c9d1ef815ff0","role":"DECIDE","entrypoint":"/solve","authority_class":"A1","rollback_available":false,"freshness":"VERIFIED","provenance":{"library_file_id":"file_000000004510824697c86e432dfc0b09"}},
    {"name":"UAB","spec_id":"UAB-KERNEL","version":"1.1","status":"ACTIVE","canonical_file":"UAB_ACTIVE.md","state_identity":"sha256:1bcb52f3939c4cabd26446477de70228a45f7e40ee023aea6c4f5eef49382c40","role":"DO","entrypoint":"/build","authority_class":"A0-A3","rollback_available":false,"freshness":"VERIFIED","provenance":{"library_file_id":"file_0000000040f481f4bfe5e48513cef332"}},
    {"name":"UAA","spec_id":"UAA-KERNEL","version":"1.0","status":"ACTIVE","canonical_file":"UAA_ACTIVE.md","state_identity":"sha256:2adc9f4bcef158072cd9226a49a2ec5e402e1b907ced586801841913f7852959","role":"PROVE_OR_REFUTE","entrypoint":"/audit","authority_class":"A0","rollback_available":false,"freshness":"VERIFIED","provenance":{"library_file_id":"file_00000000f40081f4a4fa8cc3505d9e3b"}},
    {"name":"UAL","spec_id":"UAL-KERNEL","version":"1.0","status":"ACTIVE","canonical_file":"UAL_ACTIVE.md","state_identity":"sha256:06b59a480f69f16719498b29c56185392549729a7fae59f7fed33d5b42ec4db2","role":"RETAIN_REUSABLE_LEARNING","entrypoint":"/learn","authority_class":"A0-A1","rollback_available":false,"freshness":"VERIFIED","provenance":{"library_file_id":"file_000000001090821092b595970a5f4b26"}}
  ],
  "works": [
    {"work_id":"ATLAS-WP-009","work_name":"M3.0 Authoring Foundation","project_or_domain":"Learn-it / Project Atlas","role":"IMPLEMENTATION","status":"STALE","last_observed_status":"READY_NOT_STARTED","current_state_identity":"sha256:420241b271d1fe7606be68ba3541c068bdc5ec44","parent_work_id":null,"partitions":[],"blocked_by":[],"human_action_required":false,"next_action_candidate":"REFRESH_FROM_CURRENT_AUTHORITATIVE_REPOSITORY_BEFORE_ACTION","last_material_update":"2026-08-30","freshness":"STALE","provenance":{"file_id":"file_000000008f6c81f4a1697ecaba8c7791","source_kind":"PERSISTENT_HANDOFF"}},
    {"work_id":"QA-WP-018","work_name":"M3.0 Independent QA","project_or_domain":"Learn-it / Project Atlas","role":"INDEPENDENT_QA","status":"STALE","last_observed_status":"ORACLE_READY_PRODUCT_HEAD_PENDING","current_state_identity":"sha256:62fa979833f0e673d04f23a9ec78597a15f7dd7d","parent_work_id":"ATLAS-WP-009","partitions":[],"blocked_by":["ATLAS-WP-009 exact frozen product HEAD"],"human_action_required":false,"next_action_candidate":"REFRESH_FROM_CURRENT_AUTHORITATIVE_REPOSITORY_BEFORE_ACTION","last_material_update":"2026-08-30","freshness":"STALE","provenance":{"file_id":"file_000000008f6c81f4a1697ecaba8c7791","source_kind":"PERSISTENT_HANDOFF"}},
    {"work_id":"DEV-WP-032","work_name":"Controlled-Time Atlas Navigator","project_or_domain":"Learn-it / Project Atlas","role":"DEV_TOOLING","status":"STALE","last_observed_status":"READY_NOT_STARTED","current_state_identity":"sha256:c0015f66cc0a85da142133064d4b795bead862a1","parent_work_id":null,"partitions":[],"blocked_by":[],"human_action_required":false,"next_action_candidate":"REFRESH_FROM_CURRENT_AUTHORITATIVE_REPOSITORY_BEFORE_ACTION","last_material_update":"2026-08-30","freshness":"STALE","provenance":{"file_id":"file_000000008f6c81f4a1697ecaba8c7791","source_kind":"PERSISTENT_HANDOFF"}},
    {"work_id":"QA-WP-019","work_name":"Controlled-Time Independent QA","project_or_domain":"Learn-it / Project Atlas","role":"INDEPENDENT_QA","status":"STALE","last_observed_status":"ORACLE_READY_DEV_HEAD_PENDING","current_state_identity":"sha256:efe215a085c4664a26d63ec282ff7b19221e9c9d","parent_work_id":"DEV-WP-032","partitions":[],"blocked_by":["DEV-WP-032 exact frozen dev HEAD"],"human_action_required":false,"next_action_candidate":"REFRESH_FROM_CURRENT_AUTHORITATIVE_REPOSITORY_BEFORE_ACTION","last_material_update":"2026-08-30","freshness":"STALE","provenance":{"file_id":"file_000000008f6c81f4a1697ecaba8c7791","source_kind":"PERSISTENT_HANDOFF"}}
  ],
  "partitions": [],
  "learnings": [],
  "artifacts": [
    {"artifact_id":"UCP_ACTIVE(1).md","classification":"ACTIVE","subtype":"NONCANONICAL_ACTIVE_LOOKING_ARTIFACT","status":"NONCANONICAL","disposition":"INSPECT_BEFORE_ANY_CLEANUP","provenance":{"file_id":"file_000000006e7081f49ec18ec8eefb34f9"}},
    {"artifact_id":"UAO_ACTIVE(1).md","classification":"ACTIVE","subtype":"NONCANONICAL_ACTIVE_LOOKING_ARTIFACT","status":"NONCANONICAL","disposition":"INSPECT_BEFORE_ANY_CLEANUP","provenance":{"file_id":"file_0000000013008210b5354c307b197ee9"}},
    {"artifact_id":"UAO_ACTIVE(2).md","classification":"ACTIVE","subtype":"NONCANONICAL_ACTIVE_LOOKING_ARTIFACT","status":"NONCANONICAL","disposition":"INSPECT_BEFORE_ANY_CLEANUP","provenance":{"file_id":"file_00000000ee448243a1a4fe29508985b0"}},
    {"artifact_id":"UAR_ACTIVE(1).md","classification":"ACTIVE","subtype":"NONCANONICAL_ACTIVE_LOOKING_ARTIFACT","status":"NONCANONICAL","disposition":"INSPECT_BEFORE_ANY_CLEANUP","provenance":{"file_id":"file_00000000401c81f49ff395171c3c8801"}},
    {"artifact_id":"UAL_ACTIVE(1).md","classification":"ACTIVE","subtype":"NONCANONICAL_ACTIVE_LOOKING_ARTIFACT","status":"NONCANONICAL","disposition":"INSPECT_BEFORE_ANY_CLEANUP","provenance":{"file_id":"file_0000000065d08210b8fc5c2be4ef71df"}},
    {"artifact_id":"UAO_ARCHIVE_1.2.md","classification":"ARCHIVE","status":"HISTORICAL","disposition":"DURABLE_UNTIL_HYGIENE_REVIEW","provenance":{"file_id":"file_0000000036e881f4acb48dda7f4e936c"}},
    {"artifact_id":"UAO_ARCHIVE_1.3.md","classification":"ARCHIVE","status":"VERIFIED","state_identity":"sha256:10691c283d7567fd574aa7a9c81f8c4020b3f18aaf787918f6682918e6ba832a","disposition":"DURABLE_ROLLBACK_LINEAGE","provenance":{"file_id":"file_00000000fcb882468904847d4120bdb3"}},
    {"artifact_id":"UAO_ROLLBACK_1.2.md","classification":"ROLLBACK","status":"HISTORICAL","disposition":"REVIEW_REDUNDANCY","provenance":{"file_id":"file_0000000067d082468b8cf9afd2500cda"}},
    {"artifact_id":"UAO_ROLLBACK_1.3.md","classification":"ROLLBACK","status":"VERIFIED","state_identity":"sha256:10691c283d7567fd574aa7a9c81f8c4020b3f18aaf787918f6682918e6ba832a","disposition":"DURABLE_CURRENT_ROLLBACK","provenance":{"file_id":"file_0000000019e481f49d58f313e2a34d0d"}},
    {"artifact_id":"UAO_ACTIVE_1.4_CANDIDATE.md","classification":"CANDIDATE","status":"HISTORICAL","disposition":"PROMOTED_CANDIDATE_REVIEW_RETENTION","provenance":{"file_id":"file_00000000620881f4acb48dda7f4e936c"}},
    {"artifact_id":"CONTROL_PLANE_SNAPSHOT.json","classification":"SNAPSHOT","status":"STALE","state_identity":"sha256:116f9238552fd018653ce191c3ea49ef780c6159c5e53dd7a7c09ad84f258072","disposition":"REPLACE_WITH_PHASE9B_SNAPSHOT","provenance":{"file_id":"file_00000000ece481f495793651cbcfdb1f"}},
    {"artifact_id":"HANDOVER_PROJECT_ATLAS_M3_TIME_NAVIGATOR_2026-08-30.md","classification":"HANDOFF","status":"STALE","state_identity":"sha256:28f09bc3f87a8ed617a34e713f5f5a632c58e6c9d66464275a32b9bc19e87cf1","disposition":"KEEP_AS_PROVENANCE_NOT_CURRENT_AUTHORITY","provenance":{"file_id":"file_000000008f6c81f4a1697ecaba8c7791"}},
    {"artifact_id":"telemaque-178-human-review.json","classification":"HISTORICAL","subtype":"HUMAN_REVIEW_EVIDENCE","status":"VERIFIED_FROM_PARSED_LIBRARY_CONTENT","disposition":"KEEP_AS_EVIDENCE","provenance":{"file_id":"file_00000000678c8246bbb41e1eb5c41948"}},